[
  {
    "id": "rel-product-nvidia-h100-tensor-core-gpu-incorporates-component-high-bandwidth-memory",
    "relation_type": "incorporates",
    "source_entity": "product-nvidia-h100-tensor-core-gpu",
    "target_entity": "component-high-bandwidth-memory",
    "claim_ids": [
      "claim-h100-hbm-stacks"
    ],
    "supplier": [
      {
        "value": "company-sk-hynix",
        "claim_ids": [
          "claim-trendforce-h100-hbm3-primarily-sk-hynix-2024"
        ],
        "valid_to": "2024-03"
      }
    ]
  },
  {
    "id": "rel-product-amazon-com-trainium2-incorporates-component-high-bandwidth-memory",
    "relation_type": "incorporates",
    "source_entity": "product-amazon-com-trainium2",
    "target_entity": "component-high-bandwidth-memory",
    "claim_ids": [
      "claim-trainium2-hbm-capacity"
    ],
    "supplier": [
      {
        "value": "company-samsung-electronics-co-ltd",
        "claim_ids": [
          "claim-semianalysis-trn2-hbm-samsung-2025"
        ]
      }
    ]
  },
  {
    "id": "rel-company-amazon-com-designs-product-amazon-com-trainium2",
    "relation_type": "designs",
    "source_entity": "company-amazon-com",
    "target_entity": "product-amazon-com-trainium2",
    "claim_ids": [
      "claim-aws-designed-trainium2"
    ]
  },
  {
    "id": "rel-company-sk-hynix-operates-facility-kr-m16",
    "relation_type": "operates",
    "source_entity": "company-sk-hynix",
    "target_entity": "facility-kr-m16",
    "claim_ids": [
      "claim-sk-hynix-operates-m16"
    ]
  },
  {
    "id": "rel-component-high-bandwidth-memory-requires-technology-3d-die-stacking",
    "relation_type": "requires",
    "source_entity": "component-high-bandwidth-memory",
    "target_entity": "technology-3d-die-stacking",
    "claim_ids": [
      "claim-hbm-requires-3d-die-stacking"
    ]
  },
  {
    "id": "rel-policy-us-fr-2024-28270-restricts-component-high-bandwidth-memory",
    "relation_type": "restricts",
    "source_entity": "policy-us-fr-2024-28270",
    "target_entity": "component-high-bandwidth-memory",
    "claim_ids": [
      "claim-bis-rule-2024-28270-controls-hbm-stacks",
      "claim-bis-rule-2024-28270-hbm-term-match"
    ]
  },
  {
    "id": "rel-policy-us-fr-2022-21658-restricts-component-semiconductor-manufacturing-equipment",
    "relation_type": "restricts",
    "source_entity": "policy-us-fr-2022-21658",
    "target_entity": "component-semiconductor-manufacturing-equipment",
    "claim_ids": [
      "claim-bis-rule-2022-21658-adds-sme-3b090",
      "claim-bis-rule-2022-21658-sme-term-match",
      "claim-bis-rule-2023-23049-removes-3b090"
    ]
  },
  {
    "id": "rel-policy-us-fr-2023-23049-restricts-component-semiconductor-manufacturing-equipment",
    "relation_type": "restricts",
    "source_entity": "policy-us-fr-2023-23049",
    "target_entity": "component-semiconductor-manufacturing-equipment",
    "claim_ids": [
      "claim-bis-rule-2023-23049-sme-controls",
      "claim-bis-rule-2023-23049-sme-term-match",
      "claim-bis-rule-2024-28270-revises-3b001-3b002"
    ]
  },
  {
    "id": "rel-policy-us-fr-2024-28270-restricts-component-semiconductor-manufacturing-equipment",
    "relation_type": "restricts",
    "source_entity": "policy-us-fr-2024-28270",
    "target_entity": "component-semiconductor-manufacturing-equipment",
    "claim_ids": [
      "claim-bis-rule-2024-28270-new-sme-controls",
      "claim-bis-rule-2024-28270-sme-term-match"
    ]
  }
]
