[
  {
    "id": "rel-policy-us-fr-2024-28270-restricts-component-high-bandwidth-memory",
    "relation_type": "restricts",
    "source_entity": "policy-us-fr-2024-28270",
    "target_entity": "component-high-bandwidth-memory",
    "claim_ids": [
      "claim-bis-rule-2024-28270-controls-hbm-stacks",
      "claim-bis-rule-2024-28270-hbm-term-match"
    ]
  },
  {
    "id": "rel-policy-us-fr-2022-21658-restricts-component-semiconductor-manufacturing-equipment",
    "relation_type": "restricts",
    "source_entity": "policy-us-fr-2022-21658",
    "target_entity": "component-semiconductor-manufacturing-equipment",
    "claim_ids": [
      "claim-bis-rule-2022-21658-adds-sme-3b090",
      "claim-bis-rule-2022-21658-sme-term-match",
      "claim-bis-rule-2023-23049-removes-3b090"
    ]
  },
  {
    "id": "rel-policy-us-fr-2023-23049-restricts-component-semiconductor-manufacturing-equipment",
    "relation_type": "restricts",
    "source_entity": "policy-us-fr-2023-23049",
    "target_entity": "component-semiconductor-manufacturing-equipment",
    "claim_ids": [
      "claim-bis-rule-2023-23049-sme-controls",
      "claim-bis-rule-2023-23049-sme-term-match",
      "claim-bis-rule-2024-28270-revises-3b001-3b002"
    ]
  },
  {
    "id": "rel-policy-us-fr-2024-28270-restricts-component-semiconductor-manufacturing-equipment",
    "relation_type": "restricts",
    "source_entity": "policy-us-fr-2024-28270",
    "target_entity": "component-semiconductor-manufacturing-equipment",
    "claim_ids": [
      "claim-bis-rule-2024-28270-new-sme-controls",
      "claim-bis-rule-2024-28270-sme-term-match"
    ]
  }
]
